{
  "cover": {
    "title": "XX项目建设方案",
    "subtitle": "技术方案",
    "client": "某某单位",
    "company": "北京太极信息系统技术有限公司",
    "version": "V1.0",
    "security_level": "内部资料",
    "date": "2026年6月"
  },
  "chapters": [
    {
      "number": "第一章",
      "title": "项目背景",
      "sections": [
        {
          "number": "1.1",
          "title": "建设背景",
          "paragraphs": [
            {
              "text": "随着业务数字化转型不断深入，现有系统在性能、安全性、扩展能力和运维效率方面逐步暴露出不足。"
            },
            {
              "text": "为进一步提升业务支撑能力，需结合现有系统现状和未来发展需求，开展本项目建设工作。"
            }
          ]
        },
        {
          "number": "1.2",
          "title": "建设必要性",
          "paragraphs": [
            {
              "text": "项目建设有助于提升业务处理效率，降低系统运行风险，完善信息化支撑体系。"
            },
            {
              "text": "通过本项目建设，可为后续数据治理、智能分析和业务协同提供基础条件。"
            }
          ]
        }
      ]
    },
    {
      "number": "第二章",
      "title": "建设目标",
      "sections": [
        {
          "number": "2.1",
          "title": "总体目标",
          "paragraphs": [
            {
              "text": "通过本项目建设，形成统一、安全、稳定、可扩展的信息化支撑环境。"
            },
            {
              "text": "系统建设完成后，应能够满足当前业务运行需求，并支撑未来业务发展和技术演进。"
            }
          ]
        },
        {
          "number": "2.2",
          "title": "具体目标",
          "paragraphs": [
            {
              "text": "具体目标包括提升系统稳定性、增强数据处理能力、完善安全防护体系、提高运维管理效率。"
            }
          ]
        }
      ]
    },
    {
      "number": "第三章",
      "title": "总体方案设计",
      "sections": [
        {
          "number": "3.1",
          "title": "设计原则",
          "paragraphs": [
            {
              "text": "本项目遵循统一规划、分步实施、安全可靠、先进适用、开放兼容、便于运维的原则。"
            }
          ]
        },
        {
          "number": "3.2",
          "title": "总体架构",
          "paragraphs": [
            {
              "text": "总体架构由基础设施层、平台支撑层、数据资源层、业务应用层和安全运维体系组成。"
            },
            {
              "text": "各层之间通过标准接口、统一规范和安全机制进行集成，确保系统整体稳定运行。"
            }
          ]
        }
      ]
    }
  ],
  "tables": [
    {
      "title": "风险分析表",
      "headers": {
        "c1": "风险类别",
        "c2": "风险描述",
        "c3": "影响程度",
        "c4": "应对措施"
      },
      "rows": [
        {
          "c1": "进度风险",
          "c2": "需求确认周期较长，可能影响后续设计、开发和交付进度。",
          "c3": "较高",
          "c4": "建立周例会和阶段确认机制，及时推进需求确认和问题闭环。"
        },
        {
          "c1": "技术风险",
          "c2": "部分系统接口和数据结构复杂，可能影响系统集成效果。",
          "c3": "中等",
          "c4": "提前开展接口梳理、技术验证和联调测试，形成专项解决方案。"
        },
        {
          "c1": "资源风险",
          "c2": "项目实施过程中可能存在人员、设备或外部厂商资源投入不足的问题。",
          "c3": "中等",
          "c4": "制定资源投入计划，明确责任分工，建立资源协调和问题升级机制。"
        }
      ]
    },
    {
      "title": "实施里程碑计划表",
      "headers": {
        "c1": "阶段",
        "c2": "主要任务",
        "c3": "输出成果",
        "c4": "责任主体"
      },
      "rows": [
        {
          "c1": "项目启动",
          "c2": "成立项目组，明确项目目标、范围、计划和责任分工。",
          "c3": "项目启动会纪要、项目计划",
          "c4": "项目组"
        },
        {
          "c1": "需求调研",
          "c2": "开展业务调研，梳理现状问题、业务需求和系统建设要求。",
          "c3": "需求调研报告、需求确认表",
          "c4": "业务组、技术组"
        },
        {
          "c1": "方案设计",
          "c2": "完成总体架构设计、技术路线设计和实施方案编制。",
          "c3": "项目建设方案、技术方案",
          "c4": "技术组"
        },
        {
          "c1": "系统建设",
          "c2": "完成环境部署、功能开发、系统集成和配置调试。",
          "c3": "系统部署记录、开发交付物",
          "c4": "实施组"
        }
      ]
    }
  ],
  "figures": [
    {
      "title": "系统总体架构示意图",
      "description": "请替换为系统架构图、流程图或关键截图"
    }
  ],
  "conclusion": {
    "title": "结论",
    "paragraphs": [
      {
        "text": "综上所述，本项目建设具备必要性和可行性。"
      },
      {
        "text": "通过项目实施，可有效提升业务支撑能力、系统运行稳定性和安全保障水平，为后续数字化转型和智能化应用建设奠定基础。"
      }
    ]
  },
  "images": [
    {
      "path": "../../fixtures/sample-image.svg",
      "title": "样例图片",
      "description": "用于验证 docx 图片插入能力的本地样例图片",
      "width": 96,
      "height": 96,
      "required": true
    }
  ]
}
